"","text","favorited","favoriteCount","replyToSN","created","truncated","replyToSID","id","replyToUID","statusSource","screenName","retweetCount","isRetweet","retweeted","longitude","latitude"
"1","It's time to leave your comfort zone: #THEEDIT shows you how to master winter's hottest trend  ",FALSE,4,NA,2017-12-07 22:27:01,TRUE,NA,"938897663172534272",NA,"<a href=""https://www.sprinklr.com"" rel=""nofollow"">Sprinklr</a>","NETAPORTER",1,FALSE,FALSE,NA,NA
"2","Currently pinning: it bags. @AnyaHindmarchs slouchy tote is the perfect size for carrying your essentials  we lov ",FALSE,20,NA,2017-12-07 20:46:02,TRUE,NA,"938872249582530560",NA,"<a href=""https://www.sprinklr.com"" rel=""nofollow"">Sprinklr</a>","NETAPORTER",2,FALSE,FALSE,NA,NA
"3","@megdennisx Hi Megan, we apologize about this.  If you are unable to contact DHL directly, please DM us to reconfir ",FALSE,0,"megdennisx",2017-12-07 19:55:01,TRUE,"938857199182458880","938859410138558466","49414159","<a href=""https://www.sprinklr.com"" rel=""nofollow"">Sprinklr</a>","NETAPORTER",0,FALSE,FALSE,NA,NA
"4","@megdennisx Hi Megan. It does appear that DHL is missing some information for your shipping address.  We would reco ",FALSE,0,"megdennisx",2017-12-07 19:44:30,TRUE,"938854335617929218","938856764254097408","49414159","<a href=""https://www.sprinklr.com"" rel=""nofollow"">Sprinklr</a>","NETAPORTER",0,FALSE,FALSE,NA,NA
"5","@lily_kumar As we can confirm, a manager has contacted you. Please contact us for any further assistance.",FALSE,0,"lily_kumar",2017-12-07 19:32:31,FALSE,"938822083261403136","938853750323728384","367390666","<a href=""https://www.sprinklr.com"" rel=""nofollow"">Sprinklr</a>","NETAPORTER",0,FALSE,FALSE,NA,NA
"6","@lily_kumar We will have this information further reviewed and contact you with an update.",FALSE,0,"lily_kumar",2017-12-07 18:27:51,FALSE,"938822083261403136","938837474952077312","367390666","<a href=""https://www.sprinklr.com"" rel=""nofollow"">Sprinklr</a>","NETAPORTER",0,FALSE,FALSE,NA,NA
"7","From scenic slopes to high-octane runs: this is where to hit the slopes this season #THEEDIT ",FALSE,6,NA,2017-12-07 18:19:01,FALSE,NA,"938835251383668737",NA,"<a href=""https://www.sprinklr.com"" rel=""nofollow"">Sprinklr</a>","NETAPORTER",1,FALSE,FALSE,NA,NA
"8","@lily_kumar Hi Lily, we apologize for the disappointment caused. Please DM us your order details to have further reviewed.",FALSE,0,"lily_kumar",2017-12-07 17:24:28,FALSE,"938818443981262848","938821524856942592","367390666","<a href=""https://www.sprinklr.com"" rel=""nofollow"">Sprinklr</a>","NETAPORTER",0,FALSE,FALSE,NA,NA
"9","Star of #Oceans8 + #ThePost @MsSarahPaulson talks Hollywood &amp; the coolest WhatsApp group in Hollywood #THEEDIT ",FALSE,52,NA,2017-12-07 16:55:34,TRUE,NA,"938814253045305345",NA,"<a href=""https://www.sprinklr.com"" rel=""nofollow"">Sprinklr</a>","NETAPORTER",23,FALSE,FALSE,NA,NA
"10","From designer bags to statement accessories, weve got ways to wow everyone on your gift list. Discover the ultimat ",FALSE,12,NA,2017-12-07 14:45:35,TRUE,NA,"938781540716371968",NA,"<a href=""https://www.sprinklr.com"" rel=""nofollow"">Sprinklr</a>","NETAPORTER",8,FALSE,FALSE,NA,NA
"11","Worn by Alexa Chung and Sienna Miller, #CVCStones one-of-a-kind necklaces are strung with hand-picked pebbles and ",FALSE,5,NA,2017-12-07 12:32:01,TRUE,NA,"938747926125391873",NA,"<a href=""https://www.sprinklr.com"" rel=""nofollow"">Sprinklr</a>","NETAPORTER",1,FALSE,FALSE,NA,NA
"12","Inspired by classic tuxedos, create a striking silhouette with @Balmains wool blazer. We like it styled with tailo ",FALSE,33,NA,2017-12-07 10:59:01,TRUE,NA,"938724524295688192",NA,"<a href=""https://www.sprinklr.com"" rel=""nofollow"">Sprinklr</a>","NETAPORTER",9,FALSE,FALSE,NA,NA
"13","This is how to master winter's prettiest hair trend #THEEDIT ",FALSE,12,NA,2017-12-06 21:14:02,FALSE,NA,"938516908701356036",NA,"<a href=""https://www.sprinklr.com"" rel=""nofollow"">Sprinklr</a>","NETAPORTER",1,FALSE,FALSE,NA,NA
"14","Is your skin in need of a boost? @DrBarbaraSturms Glow Drops are formulated with potent, anti-aging compounds to d ",FALSE,6,NA,2017-12-06 19:49:02,TRUE,NA,"938495516190617600",NA,"<a href=""https://www.sprinklr.com"" rel=""nofollow"">Sprinklr</a>","NETAPORTER",3,FALSE,FALSE,NA,NA
"15","PRESS PLAY: Our 5 cover stars on sexism, diversity and equal opportunities in front of (and behind) the camera ",FALSE,11,NA,2017-12-06 18:23:01,TRUE,NA,"938473871153532930",NA,"<a href=""https://www.sprinklr.com"" rel=""nofollow"">Sprinklr</a>","NETAPORTER",1,FALSE,FALSE,NA,NA
"16","With fans including Cameron Diaz and Rihanna, its no surprise that @HShandbags are a hit with the street style set ",FALSE,7,NA,2017-12-06 16:36:01,TRUE,NA,"938446944481038339",NA,"<a href=""https://www.sprinklr.com"" rel=""nofollow"">Sprinklr</a>","NETAPORTER",2,FALSE,FALSE,NA,NA
"17","#PalmAngels founder @FR365 reinterprets Southern Californian skate culture through an Italian lens. Shop our edit ",FALSE,7,NA,2017-12-06 15:02:01,TRUE,NA,"938423287343931392",NA,"<a href=""https://www.sprinklr.com"" rel=""nofollow"">Sprinklr</a>","NETAPORTER",0,FALSE,FALSE,NA,NA
"18","The perfect gifts for the most stylish people on your list (yourself included, obviously...) #THEEDIT ",FALSE,19,NA,2017-12-06 14:05:01,TRUE,NA,"938408941507227648",NA,"<a href=""https://www.sprinklr.com"" rel=""nofollow"">Sprinklr</a>","NETAPORTER",7,FALSE,FALSE,NA,NA
"19","We love how @MiuMiuOfficials earrings are playfully designed in the shape of a cats face  pair with other delica ",FALSE,23,NA,2017-12-06 12:32:30,TRUE,NA,"938385662067314688",NA,"<a href=""https://www.sprinklr.com"" rel=""nofollow"">Sprinklr</a>","NETAPORTER",1,FALSE,FALSE,NA,NA
"20","@DhirendraPSR we ship shipping to India and it can takes 2-4 working days to arrive. Let us know if we can do anything else to help.",FALSE,0,"DhirendraPSR",2017-12-06 11:30:01,FALSE,"938306298483019777","938369935654506496","1555836781","<a href=""https://www.sprinklr.com"" rel=""nofollow"">Sprinklr</a>","NETAPORTER",0,FALSE,FALSE,NA,NA
"21","Leading ladies: meet our 5 cover stars shaping the conversations on television right now #THEEDIT ",FALSE,15,NA,2017-12-06 08:31:01,TRUE,NA,"938324890419154944",NA,"<a href=""https://www.sprinklr.com"" rel=""nofollow"">Sprinklr</a>","NETAPORTER",2,FALSE,FALSE,NA,NA
"22","@chrisyjai Hello. We are sorry to hear of the disappointment caused and will gladly look into this further. Please ",FALSE,0,"chrisyjai",2017-12-05 23:45:03,TRUE,"938183828648144903","938192527236231168","621193242","<a href=""https://www.sprinklr.com"" rel=""nofollow"">Sprinklr</a>","NETAPORTER",0,FALSE,FALSE,NA,NA
"23","@maisrienisboss Hello. We are happy to pass your feedback along regarding this matter.",FALSE,0,"maisrienisboss",2017-12-05 23:43:26,FALSE,"938176258730491905","938192118132232193","737692200327360512","<a href=""https://www.sprinklr.com"" rel=""nofollow"">Sprinklr</a>","NETAPORTER",0,FALSE,FALSE,NA,NA
"24","From scarlet dresses to crimson pant suits, take your styling cues from the street style stars and make a statement ",FALSE,18,NA,2017-12-05 21:14:02,TRUE,NA,"938154519913000966",NA,"<a href=""https://www.sprinklr.com"" rel=""nofollow"">Sprinklr</a>","NETAPORTER",1,FALSE,FALSE,NA,NA
"25","This is where the LA creative crowd goes to party #THEEDIT ",FALSE,10,NA,2017-12-05 20:31:02,FALSE,NA,"938143700638629888",NA,"<a href=""https://www.sprinklr.com"" rel=""nofollow"">Sprinklr</a>","NETAPORTER",1,FALSE,FALSE,NA,NA
"26","Not only are they starring in some of todays most talked about shows, these 5 actresses are leading the way in imp ",FALSE,14,NA,2017-12-05 19:43:01,TRUE,NA,"938131617243115520",NA,"<a href=""https://www.sprinklr.com"" rel=""nofollow"">Sprinklr</a>","NETAPORTER",4,FALSE,FALSE,NA,NA
"27","From leopard-print pumps to metallic boots  discover the @Official_Ganni shoes you wont find anywhere else at ",FALSE,6,NA,2017-12-05 17:29:02,TRUE,NA,"938097898012758016",NA,"<a href=""https://www.sprinklr.com"" rel=""nofollow"">Sprinklr</a>","NETAPORTER",1,FALSE,FALSE,NA,NA
"28","Name to know: the jewelry designer + her statement earrings topping fashion-forward wish lists #THEEDIT ",FALSE,17,NA,2017-12-05 15:36:01,TRUE,NA,"938069456466661381",NA,"<a href=""https://www.sprinklr.com"" rel=""nofollow"">Sprinklr</a>","NETAPORTER",9,FALSE,FALSE,NA,NA
"29","Tis the season for treats all round: what beauty product makes the best gift? ",FALSE,4,NA,2017-12-05 13:14:24,FALSE,NA,"938033819122372609",NA,"<a href=""http://twitter.com"" rel=""nofollow"">Twitter Web Client</a>","NETAPORTER",2,FALSE,FALSE,NA,NA
"30","The magic trifecta: the only three beauty products you need for party season #THEEDIT ",FALSE,12,NA,2017-12-05 11:45:01,FALSE,NA,"938011322385600512",NA,"<a href=""https://www.sprinklr.com"" rel=""nofollow"">Sprinklr</a>","NETAPORTER",0,FALSE,FALSE,NA,NA
"31","Quilted in chevron stripes, and turning to reveal a heart at the back, its impossible not to fall in love with ",FALSE,16,NA,2017-12-05 10:22:01,TRUE,NA,"937990436349775872",NA,"<a href=""https://www.sprinklr.com"" rel=""nofollow"">Sprinklr</a>","NETAPORTER",3,FALSE,FALSE,NA,NA
"32","Quilted in chevron stripes, and turning to reveal a heart at the back, its impossible not to fall in love with ",FALSE,26,NA,2017-12-05 09:16:02,TRUE,NA,"937973828382322688",NA,"<a href=""https://www.sprinklr.com"" rel=""nofollow"">Sprinklr</a>","NETAPORTER",4,FALSE,FALSE,NA,NA
"33","Sexy, slinky + super-simple: this dress is your new party season BFF #THEEDIT ",FALSE,3,NA,2017-12-04 23:41:01,FALSE,NA,"937829122344136704",NA,"<a href=""https://www.sprinklr.com"" rel=""nofollow"">Sprinklr</a>","NETAPORTER",1,FALSE,FALSE,NA,NA
"34","Our brilliant leading ladies on representation + the evolution of female characters in our annual Women in TV debat ",FALSE,34,NA,2017-12-04 21:17:01,TRUE,NA,"937792883746369538",NA,"<a href=""https://www.sprinklr.com"" rel=""nofollow"">Sprinklr</a>","NETAPORTER",12,FALSE,FALSE,NA,NA
"35","Currently pinning: must-have knits. With exaggerated sleeves, @CalvinKleins cut-out sweater looks just as good wor ",FALSE,17,NA,2017-12-04 19:45:01,TRUE,NA,"937769732870111233",NA,"<a href=""https://www.sprinklr.com"" rel=""nofollow"">Sprinklr</a>","NETAPORTER",7,FALSE,FALSE,NA,NA
"36","For ski-wear that will look just as chic in the chalet as it will on the slopes, look to @PM_sportswear  ",FALSE,10,NA,2017-12-04 17:19:01,TRUE,NA,"937732988913246209",NA,"<a href=""https://www.sprinklr.com"" rel=""nofollow"">Sprinklr</a>","NETAPORTER",4,FALSE,FALSE,NA,NA
"37","Colombian designer @JohannaOrtizg creates feminine and elegant pieces in a fresh and wearable color palette. Shop h ",FALSE,25,NA,2017-12-04 15:01:02,TRUE,NA,"937698263679021056",NA,"<a href=""https://www.sprinklr.com"" rel=""nofollow"">Sprinklr</a>","NETAPORTER",6,FALSE,FALSE,NA,NA
"38","Her performance in @WestworldHBO earned her #GoldenGlobe + #Emmy nominations: #THEEDIT sits down with ",FALSE,9,NA,2017-12-04 14:36:01,TRUE,NA,"937691968980873216",NA,"<a href=""https://www.sprinklr.com"" rel=""nofollow"">Sprinklr</a>","NETAPORTER",2,FALSE,FALSE,NA,NA
"39","From the Studio 54-worthy metallic pantsuit to the hottest dance-floor shoes, #THEEDIT rounds up the party pieces t ",FALSE,16,NA,2017-12-04 12:23:02,TRUE,NA,"937658501354147840",NA,"<a href=""https://www.sprinklr.com"" rel=""nofollow"">Sprinklr</a>","NETAPORTER",6,FALSE,FALSE,NA,NA
"40","Chances are high that you will see @Balenciagas printed tees again and again in blog posts and social media feeds. ",FALSE,9,NA,2017-12-04 10:31:52,TRUE,NA,"937630527431020545",NA,"<a href=""https://www.sprinklr.com"" rel=""nofollow"">Sprinklr</a>","NETAPORTER",2,FALSE,FALSE,NA,NA
"41","@annabeltwiddle , were sorry to hear this. Please DM your details and order number and we will look into this for you.",FALSE,0,"annabeltwiddle",2017-12-04 09:49:00,FALSE,"937613871510155264","937619739400130560","126378013","<a href=""https://www.sprinklr.com"" rel=""nofollow"">Sprinklr</a>","NETAPORTER",0,FALSE,FALSE,NA,NA
"42","Press play to find out what our 5 cover stars really think about sexism, diversity and equal opportunities in front ",FALSE,73,NA,2017-12-03 23:25:41,TRUE,NA,"937462874007621633",NA,"<a href=""https://www.sprinklr.com"" rel=""nofollow"">Sprinklr</a>","NETAPORTER",19,FALSE,FALSE,NA,NA
"43","Our annual gift list is here (spoiler: it's the wish list of dreams) #THEEDIT ",FALSE,23,NA,2017-12-03 20:12:01,FALSE,NA,"937414138069954561",NA,"<a href=""https://www.sprinklr.com"" rel=""nofollow"">Sprinklr</a>","NETAPORTER",4,FALSE,FALSE,NA,NA
"44","Currently pinning: the hottest heels. From shirt dresses to jeans, elevate any outfit with the addition of ",FALSE,20,NA,2017-12-03 18:45:02,TRUE,NA,"937392246277771264",NA,"<a href=""https://www.sprinklr.com"" rel=""nofollow"">Sprinklr</a>","NETAPORTER",3,FALSE,FALSE,NA,NA
"45","@skyeezfalling Thank you for contacting us. To better assist you, please DM us your email address.",FALSE,0,"skyeezfalling",2017-12-03 18:26:27,FALSE,"937368293622427648","937387571897921536","164002445","<a href=""https://www.sprinklr.com"" rel=""nofollow"">Sprinklr</a>","NETAPORTER",0,FALSE,FALSE,NA,NA
"46","The festive season can feel anything but restful. Restore a sense of calm with @AureliaSkincares Peaceful Glow col ",FALSE,8,NA,2017-12-03 16:26:01,TRUE,NA,"937357262632480769",NA,"<a href=""https://www.sprinklr.com"" rel=""nofollow"">Sprinklr</a>","NETAPORTER",1,FALSE,FALSE,NA,NA
"47","A sophisticated fusion of a clutch and a shoulder bag, @Pradas Wallet On A Chain bag is perfect for any occasion  ",FALSE,3,NA,2017-12-03 14:30:06,TRUE,NA,"937328092707803136",NA,"<a href=""https://www.sprinklr.com"" rel=""nofollow"">Sprinklr</a>","NETAPORTER",2,FALSE,FALSE,NA,NA
"48","She helped to kick-start the reality TV phenomenon, but now @NicoleRichie is making people laugh for all the right ",FALSE,17,NA,2017-12-03 12:27:01,TRUE,NA,"937297118653505536",NA,"<a href=""https://www.sprinklr.com"" rel=""nofollow"">Sprinklr</a>","NETAPORTER",5,FALSE,FALSE,NA,NA
"49","The genius packing formula to solve day-to-night dressing with just a carry-on #THEEDIT  ",FALSE,18,NA,2017-12-03 10:10:01,FALSE,NA,"937262639998259201",NA,"<a href=""https://www.sprinklr.com"" rel=""nofollow"">Sprinklr</a>","NETAPORTER",3,FALSE,FALSE,NA,NA
"50","The game-changing beauty trifecta that never fails to make the dress code #THEEDIT ",FALSE,11,NA,2017-12-02 23:03:01,FALSE,NA,"937094785650831366",NA,"<a href=""https://www.sprinklr.com"" rel=""nofollow"">Sprinklr</a>","NETAPORTER",1,FALSE,FALSE,NA,NA
"51","Currently pinning: the accessories edit. An instant cult hit, we love how @LeSpecsOfficials cat-eye sunglasses com ",FALSE,15,NA,2017-12-02 21:42:01,TRUE,NA,"937074398846246912",NA,"<a href=""https://www.sprinklr.com"" rel=""nofollow"">Sprinklr</a>","NETAPORTER",2,FALSE,FALSE,NA,NA
"52","Printed with vibrant florals, @AllThingsMochis handcrafted pieces are intended to symbolize fun, integrity, unity ",FALSE,11,NA,2017-12-02 19:36:01,TRUE,NA,"937042689408880640",NA,"<a href=""https://www.sprinklr.com"" rel=""nofollow"">Sprinklr</a>","NETAPORTER",4,FALSE,FALSE,NA,NA
"53","""It's our responsibility - through the media - to create the new normal in terms of what is and isn't ok"". Our bril ",FALSE,8,NA,2017-12-02 17:15:38,TRUE,NA,"937007359897096192",NA,"<a href=""https://www.sprinklr.com"" rel=""nofollow"">Sprinklr</a>","NETAPORTER",2,FALSE,FALSE,NA,NA
"54","@sophierimmerr To better assist you, please DM us your registered email address.",FALSE,0,"sophierimmerr",2017-12-02 16:11:00,FALSE,"936965957477715969","936991097838030848","1349724620","<a href=""https://www.sprinklr.com"" rel=""nofollow"">Sprinklr</a>","NETAPORTER",0,FALSE,FALSE,NA,NA
"55","Your weekend update is here  shop the newest pieces now at #NETAPORTER. ",FALSE,13,NA,2017-12-02 15:01:01,FALSE,NA,"936973483438899201",NA,"<a href=""https://www.sprinklr.com"" rel=""nofollow"">Sprinklr</a>","NETAPORTER",3,FALSE,FALSE,NA,NA
"56","From asymmetric knitwear to printed tees, we asked @Margiela to tap into its archives to create a street style-insp ",FALSE,13,NA,2017-12-02 14:12:01,TRUE,NA,"936961151837134848",NA,"<a href=""https://www.sprinklr.com"" rel=""nofollow"">Sprinklr</a>","NETAPORTER",2,FALSE,FALSE,NA,NA
"57","#THEEDIT sits down with @Insecurehbo's @YvonneOrji + 4 of the most compelling women in TV right now ",FALSE,138,NA,2017-12-02 12:34:01,TRUE,NA,"936936491225370626",NA,"<a href=""https://www.sprinklr.com"" rel=""nofollow"">Sprinklr</a>","NETAPORTER",31,FALSE,FALSE,NA,NA
"58","From the metallic pantsuit to the must-buy dance-floor shoes, these are the party pieces to own now #THEEDIT ",FALSE,18,NA,2017-12-02 11:15:02,TRUE,NA,"936916612879224832",NA,"<a href=""https://www.sprinklr.com"" rel=""nofollow"">Sprinklr</a>","NETAPORTER",3,FALSE,FALSE,NA,NA
"59","Featuring the beautiful and brilliant @ImaanHammam, @PORTERmagazines Winter Escape issue is out now  ",FALSE,6,NA,2017-12-02 09:31:15,TRUE,NA,"936890495531237376",NA,"<a href=""https://www.sprinklr.com"" rel=""nofollow"">Sprinklr</a>","NETAPORTER",2,FALSE,FALSE,NA,NA
"60","@tiffymich We're sorry for the delay. Please DM us your details and your order number and we will look into this for you.",FALSE,0,"tiffymich",2017-12-02 08:27:29,FALSE,"936845139099639808","936874447918657536","43833109","<a href=""https://www.sprinklr.com"" rel=""nofollow"">Sprinklr</a>","NETAPORTER",0,FALSE,FALSE,NA,NA
"61","It wouldn't be party season without a dusting of sparkles. Here's how to get glitter right #THEEDIT ",FALSE,23,NA,2017-12-01 23:03:01,TRUE,NA,"936732395256057856",NA,"<a href=""https://www.sprinklr.com"" rel=""nofollow"">Sprinklr</a>","NETAPORTER",9,FALSE,FALSE,NA,NA
"62",".@JenMeyerJewelrys delicate and timeless designs are perfect for wearing as everyday signatures  ",FALSE,11,NA,2017-12-01 21:53:01,TRUE,NA,"936714780500471808",NA,"<a href=""https://www.sprinklr.com"" rel=""nofollow"">Sprinklr</a>","NETAPORTER",1,FALSE,FALSE,NA,NA
"63","Treat someone special to @Mauli_Rituals Beautiful Day Blissful Night Kit. Featuring the brands best-selling produ ",FALSE,17,NA,2017-12-01 20:33:01,TRUE,NA,"936694646545305600",NA,"<a href=""https://www.sprinklr.com"" rel=""nofollow"">Sprinklr</a>","NETAPORTER",1,FALSE,FALSE,NA,NA
"64","Add an element of individuality to your look by wearing your initials. We love @ellery_lands alphabetical earrings ",FALSE,20,NA,2017-12-01 18:56:02,TRUE,NA,"936670239265361922",NA,"<a href=""https://www.sprinklr.com"" rel=""nofollow"">Sprinklr</a>","NETAPORTER",2,FALSE,FALSE,NA,NA
"65","Their TV shows are challenging the norm of how women are represented on the small screen, but what do our 5 cover s ",FALSE,17,NA,2017-12-01 17:18:45,TRUE,NA,"936645757398077441",NA,"<a href=""https://www.sprinklr.com"" rel=""nofollow"">Sprinklr</a>","NETAPORTER",3,FALSE,FALSE,NA,NA
"66","See Golden Globe-winning @MGyllenhaal + 4 of the best stars of the small screen in our annual Women in TV issue ",FALSE,27,NA,2017-12-01 17:12:01,TRUE,NA,"936644065726287873",NA,"<a href=""https://www.sprinklr.com"" rel=""nofollow"">Sprinklr</a>","NETAPORTER",6,FALSE,FALSE,NA,NA
"67","Spotted on Olivia Palermo and Sienna Miller, @hshandbagss timeless designs are perfect for any occasion  shop now ",FALSE,12,NA,2017-12-01 15:01:01,TRUE,NA,"936611096164782080",NA,"<a href=""https://www.sprinklr.com"" rel=""nofollow"">Sprinklr</a>","NETAPORTER",4,FALSE,FALSE,NA,NA
"68","@annabeltwiddle A member of our Customer Care team will contact you right-away.",FALSE,0,"annabeltwiddle",2017-12-01 12:03:00,FALSE,"936562756001697792","936566297525149697","126378013","<a href=""https://www.sprinklr.com"" rel=""nofollow"">Sprinklr</a>","NETAPORTER",0,FALSE,FALSE,NA,NA
"69","Add a cheerful splash of color to a monochrome outfit with @DolceGabbanas rose printed scarf  the perfect way to ",FALSE,18,NA,2017-12-01 11:55:39,TRUE,NA,"936564449305071616",NA,"<a href=""https://www.sprinklr.com"" rel=""nofollow"">Sprinklr</a>","NETAPORTER",3,FALSE,FALSE,NA,NA
"70","@annabeltwiddle We're sorry you're unable to reach us. Please DM us your contact details and a dedicated member of ",FALSE,1,"annabeltwiddle",2017-12-01 11:36:09,TRUE,"936558710809419777","936559540451074048","126378013","<a href=""https://www.sprinklr.com"" rel=""nofollow"">Sprinklr</a>","NETAPORTER",0,FALSE,FALSE,NA,NA
"71","Winter's prettiest hair trend is the chicest cure for bad hair days #THEEDIT ",FALSE,9,NA,2017-12-01 10:32:02,FALSE,NA,"936543403482976256",NA,"<a href=""https://www.sprinklr.com"" rel=""nofollow"">Sprinklr</a>","NETAPORTER",2,FALSE,FALSE,NA,NA
"72","@kacee_x Were sorry to hear this. A member of our Customer Care team will be in touch shortly.",FALSE,0,"kacee_x",2017-12-01 09:27:00,FALSE,"936518885527912448","936527038357426177","1091781901","<a href=""https://www.sprinklr.com"" rel=""nofollow"">Sprinklr</a>","NETAPORTER",0,FALSE,FALSE,NA,NA
"73","@annabelmak We're really sorry to hear this. Please DM us your order details and a dedicated member of our Customer ",FALSE,0,"annabelmak",2017-12-01 09:21:28,TRUE,"936440657966637056","936525645391294465","81039391","<a href=""https://www.sprinklr.com"" rel=""nofollow"">Sprinklr</a>","NETAPORTER",0,FALSE,FALSE,NA,NA
"74","Currently pinning: high shine. Tap into this seasons trend for all things glossy with @CalvinKleins futuristic-st ",FALSE,8,NA,2017-11-30 22:31:01,TRUE,NA,"936361955866173440",NA,"<a href=""https://www.sprinklr.com"" rel=""nofollow"">Sprinklr</a>","NETAPORTER",1,FALSE,FALSE,NA,NA
"75","Here's how to do party season in slick separates #THEEDIT ",FALSE,20,NA,2017-11-30 21:14:01,FALSE,NA,"936342577183412225",NA,"<a href=""https://www.sprinklr.com"" rel=""nofollow"">Sprinklr</a>","NETAPORTER",2,FALSE,FALSE,NA,NA
"76","With a vivid red lining that reflects the designers iconic pumps, @LouboutinWorlds glittered leather wallet doubl ",FALSE,38,NA,2017-11-30 19:03:01,TRUE,NA,"936309609840726016",NA,"<a href=""https://www.sprinklr.com"" rel=""nofollow"">Sprinklr</a>","NETAPORTER",7,FALSE,FALSE,NA,NA
"77","Like your brunch with a side of Hollywood history? #THEEDIT shows you where to go in #LA ",FALSE,9,NA,2017-11-30 18:11:02,FALSE,NA,"936296526313328640",NA,"<a href=""https://www.sprinklr.com"" rel=""nofollow"">Sprinklr</a>","NETAPORTER",1,FALSE,FALSE,NA,NA
"78","One of the most celebrated Latin American designers, @SilviaTcherassis vibrant Colombian-inspired pieces are now a ",FALSE,24,NA,2017-11-30 16:18:32,TRUE,NA,"936268216841760768",NA,"<a href=""https://www.sprinklr.com"" rel=""nofollow"">Sprinklr</a>","NETAPORTER",5,FALSE,FALSE,NA,NA
"79","Celebrating 5 of our favorite women in TV right now: @EvanRachelWood, @YvonneOrji, @MGyllenhaal, @NicoleRichie &amp; ",FALSE,107,NA,2017-11-30 13:41:33,TRUE,NA,"936228709991886848",NA,"<a href=""https://www.sprinklr.com"" rel=""nofollow"">Sprinklr</a>","NETAPORTER",22,FALSE,FALSE,NA,NA
"80","Be the belle of the ball in @Gucci's fuchsia evening gown. Nod to the brand's runway styling and pair with platform ",FALSE,12,NA,2017-11-30 11:07:29,TRUE,NA,"936189939972280321",NA,"<a href=""https://www.sprinklr.com"" rel=""nofollow"">Sprinklr</a>","NETAPORTER",3,FALSE,FALSE,NA,NA
"81","@tubbsmcguire , were sorry you are disappointed. Please DM us your details and order number and a member of our Cu ",FALSE,0,"tubbsmcguire",2017-11-30 10:41:00,TRUE,"936181855300325376","936183273646120960","19153083","<a href=""https://www.sprinklr.com"" rel=""nofollow"">Sprinklr</a>","NETAPORTER",0,FALSE,FALSE,NA,NA
"82","As she celebrates 3 decades at the top, supermodel #ClaudiaSchiffer talks retirement, regret &amp; returning to the run ",FALSE,15,NA,2017-11-30 00:19:01,TRUE,NA,"936026747514097664",NA,"<a href=""https://www.sprinklr.com"" rel=""nofollow"">Sprinklr</a>","NETAPORTER",4,FALSE,FALSE,NA,NA
"83","@kacee_x Sorry for any inconvenience caused. Please DM us your contact details to assist you further.",FALSE,0,"kacee_x",2017-11-29 22:34:31,FALSE,"935987454607282176","936000446417784833","1091781901","<a href=""https://www.sprinklr.com"" rel=""nofollow"">Sprinklr</a>","NETAPORTER",0,FALSE,FALSE,NA,NA
"84","'The new Bardot': #ClaudiaSchiffer's iconic 90s supermodel look is as wearable now as it was then. Here's how to ge ",FALSE,15,NA,2017-11-29 21:05:02,TRUE,NA,"935977926922833920",NA,"<a href=""https://www.sprinklr.com"" rel=""nofollow"">Sprinklr</a>","NETAPORTER",3,FALSE,FALSE,NA,NA
"85","Cover star #ClaudiaSchiffer on the stories behind her most memorable runway moments #THEEDIT ",FALSE,9,NA,2017-11-29 19:25:51,FALSE,NA,"935952970314903552",NA,"<a href=""https://www.sprinklr.com"" rel=""nofollow"">Sprinklr</a>","NETAPORTER",1,FALSE,FALSE,NA,NA
"86","What better way to get ready for the party season than with @BalmainHairs advent calendar  filled with the house ",FALSE,5,NA,2017-11-29 17:12:01,TRUE,NA,"935919289286131712",NA,"<a href=""https://www.sprinklr.com"" rel=""nofollow"">Sprinklr</a>","NETAPORTER",0,FALSE,FALSE,NA,NA
"87","Dazzle by day in this season's high-shine pants, sparkling blouses and lustrous dresses  discover our edit of the ",FALSE,22,NA,2017-11-29 16:14:01,TRUE,NA,"935904692386844673",NA,"<a href=""https://www.sprinklr.com"" rel=""nofollow"">Sprinklr</a>","NETAPORTER",4,FALSE,FALSE,NA,NA
"88","Perfect timing! @JaegerLeCoultres exquisite timepieces have arrived  find the new forever watch youll turn to ag ",FALSE,2,NA,2017-11-29 12:59:36,TRUE,NA,"935855764736012288",NA,"<a href=""https://www.sprinklr.com"" rel=""nofollow"">Sprinklr</a>","NETAPORTER",0,FALSE,FALSE,NA,NA
"89","Bold accessories are the best way to add a pop of color to any look. This @ElizandJames bag is sized to hold the es ",FALSE,11,NA,2017-11-29 10:00:02,TRUE,NA,"935810575833223170",NA,"<a href=""https://www.sprinklr.com"" rel=""nofollow"">Sprinklr</a>","NETAPORTER",4,FALSE,FALSE,NA,NA
